{
  "address_mapping": {
    "method": "runtime_address_minus_module_delta",
    "module_delta": "0xbb63e000",
    "runtime_module_base": "0xbb64e000",
    "static_image_base": "0x10000"
  },
  "capture_id": "nevergone-gameplay-device-20261020-pid15911",
  "capture_manifest_sha256": "cb6b2166c65cca168dedafd0aa50eab7c7c647f4b8caf236e0f64b34b2c15612",
  "events": [
    {
      "caller_addresses": [
        "0x544a60"
      ],
      "caller_match_state": "matched",
      "caller_node_ids": [
        "function:98a579230acbea67b6a3be427716e94b1314035e3315dc52f4bd024e3bf023a6"
      ],
      "callsite_address": "0x544bdc",
      "callsite_match_state": "matched",
      "callsite_node_ids": [
        "operation:627a1b14d26a2004ae0833105607db8cc77facb964346f7a861b0cfd430007d9"
      ],
      "callsite_runtime_address": "0xbbb82bdc",
      "capture_id": "nevergone-gameplay-device-20261020-pid15911",
      "match_state": "matched",
      "sequence": 0,
      "static_target_entries": [
        "00544a40"
      ],
      "static_target_match_state": "matched",
      "target_address": "0x544a40",
      "target_match_state": "matched",
      "target_node_ids": [
        "function:0b3d984b71db09e5abbc42cc4def79b7e1061ed9b4a87c526342eec9953117a1"
      ],
      "target_runtime_address": "0xbbb82a40"
    },
    {
      "caller_addresses": [
        "0x544a60"
      ],
      "caller_match_state": "matched",
      "caller_node_ids": [
        "function:98a579230acbea67b6a3be427716e94b1314035e3315dc52f4bd024e3bf023a6"
      ],
      "callsite_address": "0x544bdc",
      "callsite_match_state": "matched",
      "callsite_node_ids": [
        "operation:627a1b14d26a2004ae0833105607db8cc77facb964346f7a861b0cfd430007d9"
      ],
      "callsite_runtime_address": "0xbbb82bdc",
      "capture_id": "nevergone-gameplay-device-20261020-pid15911",
      "match_state": "matched",
      "sequence": 1,
      "static_target_entries": [
        "00544a40"
      ],
      "static_target_match_state": "matched",
      "target_address": "0x544a40",
      "target_match_state": "matched",
      "target_node_ids": [
        "function:0b3d984b71db09e5abbc42cc4def79b7e1061ed9b4a87c526342eec9953117a1"
      ],
      "target_runtime_address": "0xbbb82a40"
    },
    {
      "caller_addresses": [
        "0x544a60"
      ],
      "caller_match_state": "matched",
      "caller_node_ids": [
        "function:98a579230acbea67b6a3be427716e94b1314035e3315dc52f4bd024e3bf023a6"
      ],
      "callsite_address": "0x544bdc",
      "callsite_match_state": "matched",
      "callsite_node_ids": [
        "operation:627a1b14d26a2004ae0833105607db8cc77facb964346f7a861b0cfd430007d9"
      ],
      "callsite_runtime_address": "0xbbb82bdc",
      "capture_id": "nevergone-gameplay-device-20261020-pid15911",
      "match_state": "matched",
      "sequence": 2,
      "static_target_entries": [
        "00544a40"
      ],
      "static_target_match_state": "matched",
      "target_address": "0x544a40",
      "target_match_state": "matched",
      "target_node_ids": [
        "function:0b3d984b71db09e5abbc42cc4def79b7e1061ed9b4a87c526342eec9953117a1"
      ],
      "target_runtime_address": "0xbbb82a40"
    },
    {
      "caller_addresses": [
        "0x544a60"
      ],
      "caller_match_state": "matched",
      "caller_node_ids": [
        "function:98a579230acbea67b6a3be427716e94b1314035e3315dc52f4bd024e3bf023a6"
      ],
      "callsite_address": "0x544bdc",
      "callsite_match_state": "matched",
      "callsite_node_ids": [
        "operation:627a1b14d26a2004ae0833105607db8cc77facb964346f7a861b0cfd430007d9"
      ],
      "callsite_runtime_address": "0xbbb82bdc",
      "capture_id": "nevergone-gameplay-device-20261020-pid15911",
      "match_state": "matched",
      "sequence": 3,
      "static_target_entries": [
        "00544a40"
      ],
      "static_target_match_state": "matched",
      "target_address": "0x544a40",
      "target_match_state": "matched",
      "target_node_ids": [
        "function:0b3d984b71db09e5abbc42cc4def79b7e1061ed9b4a87c526342eec9953117a1"
      ],
      "target_runtime_address": "0xbbb82a40"
    },
    {
      "caller_addresses": [
        "0x544a60"
      ],
      "caller_match_state": "matched",
      "caller_node_ids": [
        "function:98a579230acbea67b6a3be427716e94b1314035e3315dc52f4bd024e3bf023a6"
      ],
      "callsite_address": "0x544bdc",
      "callsite_match_state": "matched",
      "callsite_node_ids": [
        "operation:627a1b14d26a2004ae0833105607db8cc77facb964346f7a861b0cfd430007d9"
      ],
      "callsite_runtime_address": "0xbbb82bdc",
      "capture_id": "nevergone-gameplay-device-20261020-pid15911",
      "match_state": "matched",
      "sequence": 4,
      "static_target_entries": [
        "00544a40"
      ],
      "static_target_match_state": "matched",
      "target_address": "0x544a40",
      "target_match_state": "matched",
      "target_node_ids": [
        "function:0b3d984b71db09e5abbc42cc4def79b7e1061ed9b4a87c526342eec9953117a1"
      ],
      "target_runtime_address": "0xbbb82a40"
    },
    {
      "caller_addresses": [
        "0x544a60"
      ],
      "caller_match_state": "matched",
      "caller_node_ids": [
        "function:98a579230acbea67b6a3be427716e94b1314035e3315dc52f4bd024e3bf023a6"
      ],
      "callsite_address": "0x544bdc",
      "callsite_match_state": "matched",
      "callsite_node_ids": [
        "operation:627a1b14d26a2004ae0833105607db8cc77facb964346f7a861b0cfd430007d9"
      ],
      "callsite_runtime_address": "0xbbb82bdc",
      "capture_id": "nevergone-gameplay-device-20261020-pid15911",
      "match_state": "matched",
      "sequence": 5,
      "static_target_entries": [
        "00544a40"
      ],
      "static_target_match_state": "matched",
      "target_address": "0x544a40",
      "target_match_state": "matched",
      "target_node_ids": [
        "function:0b3d984b71db09e5abbc42cc4def79b7e1061ed9b4a87c526342eec9953117a1"
      ],
      "target_runtime_address": "0xbbb82a40"
    },
    {
      "caller_addresses": [
        "0x544a60"
      ],
      "caller_match_state": "matched",
      "caller_node_ids": [
        "function:98a579230acbea67b6a3be427716e94b1314035e3315dc52f4bd024e3bf023a6"
      ],
      "callsite_address": "0x544bdc",
      "callsite_match_state": "matched",
      "callsite_node_ids": [
        "operation:627a1b14d26a2004ae0833105607db8cc77facb964346f7a861b0cfd430007d9"
      ],
      "callsite_runtime_address": "0xbbb82bdc",
      "capture_id": "nevergone-gameplay-device-20261020-pid15911",
      "match_state": "matched",
      "sequence": 6,
      "static_target_entries": [
        "00544a40"
      ],
      "static_target_match_state": "matched",
      "target_address": "0x544a40",
      "target_match_state": "matched",
      "target_node_ids": [
        "function:0b3d984b71db09e5abbc42cc4def79b7e1061ed9b4a87c526342eec9953117a1"
      ],
      "target_runtime_address": "0xbbb82a40"
    },
    {
      "caller_addresses": [
        "0x544a60"
      ],
      "caller_match_state": "matched",
      "caller_node_ids": [
        "function:98a579230acbea67b6a3be427716e94b1314035e3315dc52f4bd024e3bf023a6"
      ],
      "callsite_address": "0x544bdc",
      "callsite_match_state": "matched",
      "callsite_node_ids": [
        "operation:627a1b14d26a2004ae0833105607db8cc77facb964346f7a861b0cfd430007d9"
      ],
      "callsite_runtime_address": "0xbbb82bdc",
      "capture_id": "nevergone-gameplay-device-20261020-pid15911",
      "match_state": "matched",
      "sequence": 7,
      "static_target_entries": [
        "00544a40"
      ],
      "static_target_match_state": "matched",
      "target_address": "0x544a40",
      "target_match_state": "matched",
      "target_node_ids": [
        "function:0b3d984b71db09e5abbc42cc4def79b7e1061ed9b4a87c526342eec9953117a1"
      ],
      "target_runtime_address": "0xbbb82a40"
    },
    {
      "caller_addresses": [
        "0x544a60"
      ],
      "caller_match_state": "matched",
      "caller_node_ids": [
        "function:98a579230acbea67b6a3be427716e94b1314035e3315dc52f4bd024e3bf023a6"
      ],
      "callsite_address": "0x544bdc",
      "callsite_match_state": "matched",
      "callsite_node_ids": [
        "operation:627a1b14d26a2004ae0833105607db8cc77facb964346f7a861b0cfd430007d9"
      ],
      "callsite_runtime_address": "0xbbb82bdc",
      "capture_id": "nevergone-gameplay-device-20261020-pid15911",
      "match_state": "matched",
      "sequence": 8,
      "static_target_entries": [
        "00544a40"
      ],
      "static_target_match_state": "matched",
      "target_address": "0x544a40",
      "target_match_state": "matched",
      "target_node_ids": [
        "function:0b3d984b71db09e5abbc42cc4def79b7e1061ed9b4a87c526342eec9953117a1"
      ],
      "target_runtime_address": "0xbbb82a40"
    },
    {
      "caller_addresses": [
        "0x544a60"
      ],
      "caller_match_state": "matched",
      "caller_node_ids": [
        "function:98a579230acbea67b6a3be427716e94b1314035e3315dc52f4bd024e3bf023a6"
      ],
      "callsite_address": "0x544bdc",
      "callsite_match_state": "matched",
      "callsite_node_ids": [
        "operation:627a1b14d26a2004ae0833105607db8cc77facb964346f7a861b0cfd430007d9"
      ],
      "callsite_runtime_address": "0xbbb82bdc",
      "capture_id": "nevergone-gameplay-device-20261020-pid15911",
      "match_state": "matched",
      "sequence": 9,
      "static_target_entries": [
        "00544a40"
      ],
      "static_target_match_state": "matched",
      "target_address": "0x544a40",
      "target_match_state": "matched",
      "target_node_ids": [
        "function:0b3d984b71db09e5abbc42cc4def79b7e1061ed9b4a87c526342eec9953117a1"
      ],
      "target_runtime_address": "0xbbb82a40"
    },
    {
      "caller_addresses": [
        "0x544a60"
      ],
      "caller_match_state": "matched",
      "caller_node_ids": [